{
  "schema_version": "1.0",
  "feedback_id": "c1111111-1111-4111-8111-111111111111",
  "occurred_at": "2026-03-10T18:45:22Z",
  "surface": "library",
  "operation": "resolve_context",
  "feedback_outcome": "helpful",
  "trace_id": "aaaaaaaa-aaaa-4aaa-8aaa-aaaaaaaaaaaa",
  "request_id": "req-usage-event-001",
  "session_id": "session-order-debug-001",
  "task_id": "task-order-debug-001",
  "actor_id": "planner_agent",
  "tenant_id": "tenant-001",
  "root_path_hash": "4f4df36dd979de0b7c6a5b4f2176fa4c2fbb0b3e9d1ec6f7d2d5d77f6b3722d2",
  "feedback_reason": "Selected units were sufficient to localize the edit target without extra raw code reads.",
  "followup_action": "planned",
  "payload": {
    "selected_units_reviewed": 4,
    "followup_reads": 0
  }
}
